Question,formal,informal
What breed of dog is this?,This is an English Springer Spaniel.,"That's a Springer Spaniel, for sure."
What is the primary color of the dog's coat?,The primary color of the dog's coat is black.,Mostly white with some cool black spots thrown in.
Does this dog have any distinctive markings?,"Yes, the dog has distinctive white markings with speckles, commonly referred to as ticking.","Oh yeah, it's got those awesome black patches and speckles."
What type of ears does this dog have?,"The dog has long, pendulous ears characteristic of the breed.",The kind that you wanna squish—super floppy!
Is the dog's tail visible in the image?,"No, the dog’s tail is not visible in the image.","Nah, the tail's on a stealth mode."
What is the texture of the dog's fur?,"The dog's fur appears to be of medium length with a slight wave, indicative of a silky and possibly dense texture.","Smooth as silk, not a shaggy vibe."
Can you describe the dog's eyes?,"The dog's eyes are dark, round, and expressive, conveying attentiveness.",Deep and dark—like little olives.
What is the dog's general body shape and size?,"The dog has a compact and athletic body shape, medium in size, with well-balanced proportions.",A solid mid-sized buddy with a sturdy build.
"Is the dog wearing any identification, like a collar?","Yes, the dog is wearing a red collar, which may serve as identification.","Yep, rockin' a bright red collar."
What is the dog's posture in the image?,The dog is sitting upright with a straight posture.,"Just chillin' on the floor, all proper-like."
Is the dog's mouth open or closed?,The dog's mouth is closed in the image.,Zipped up tight.
Does the dog appear to be in a relaxed state?,"The dog appears to be calm and at ease, with a relaxed demeanor.",Totally chillaxing.
What type of flooring is the dog sitting on?,The dog is sitting on a wooden floor.,That classic wooden floor style.
Can you see any toys or dog-related items in the image?,"No, there are no toys or dog-related items visible in the image.","Zero toys around, just the pupper."
Is the dog alone in the picture or are there people/other animals present?,The dog appears to be alone in the picture.,"Flying solo, no crowd."
What kind of expression does the dog's face convey?,The dog's face conveys a gentle and attentive expression.,Sorta like he's waiting for the next move.
Does the dog have a shiny coat?,"Yes, the dog's coat appears healthy and has a natural sheen.","Not bling-bling shiny, but it’s got a good gloss."
"Are the dog's nails visible, and if so, are they well-trimmed?",The dog's nails are not clearly visible in the image.,"Can't spot the nails, they're camera shy."
Is there anything unusual about the dog's appearance?,There is nothing unusual about the dog’s appearance; it seems typical of its breed.,"Just your regular, adorable furball."
What could be the approximate age of the dog?,"Without clear indicators of age, it is challenging to ascertain; however, the dog does not display prominent signs of aging and could be considered mature.","Not a fresh pup, but not an old-timer either. Adulting maybe?"
What is the stance of the dog?,The canine subject is presented in a sedentary posture.,Plopped down on the floor with all the chill vibes.
How is the lighting in the photograph affecting the dog's appearance?,"The illumination in the photograph appears to be frontal and somewhat stark, potentially accentuating the contrast in the dog's coat.",Got a bit of a glare thing going on—kinda gives it a dramatic look.
Are the dog's whiskers visible?,"Indeed, the vibrissae, or whiskers, are discernible upon the subject's muzzle.","Yeah, you can see the whisker action happening."
What is the expression in the dog's eyes?,The expression vested within the canine's eyes could be described as alert yet placid.,"Those peepers are saying, ""I'm all ears, what's up?"""
How would you describe the set of the dog's ears?,"The dog's ears are set moderately low and lie close to the cheeks, which is characteristic of the breed.","They're hanging out, low and lazy-like."
Is the dog's coat a single or double coat?,"The breed in question typically possesses a double-layered coat, which is suggested by the subject's appearance.","Hard to tell, but it's probably a double—thick and ready for action."
What is the condition of the dog's coat?,The condition of the dog’s coat can be described as well-maintained and lustrous.,It's lookin' pretty slick and well-kept.
Does the dog appear to have been groomed recently?,"While such a determination is somewhat speculative, the dog's neat appearance could indicate recent grooming.","Definitely, looks like it's had a fresh primp session."
What kind of environment is the dog in?,"The environment is residential in nature, likely the interior of a domicile.",A cozy home setup with a neat wooden floor.
How would you describe the build of the dog?,"The canine displays a robust build, indicative of good health and appropriate nourishment.","It's a solid, athletic kind of frame—built for zoomies."
Does the dog have a broad or narrow head?,"The dog possesses a head of moderate breadth, aligning with the standards of the breed.","More on the broad side, with plenty of smarts inside."
Are the dog's front legs visible in the image?,The anterior limbs of the subject are indeed visible in the photograph.,"Yup, they're right there, front and center."
Can you discern the dog's gender from the image?,The gender of the canine is not readily ascertainable from the visual provided.,"Nope, that's a mystery without more info."
Is there any indication of the dog's activity level?,There is no direct indication of the dog's level of activity within the confines of this still image.,"Looks pretty mellow now, but those legs tell me it can go fast."
Does the dog look like it has been engaged in physical activity recently?,"The dog does not exhibit signs of recent vigorous exertion, such as panting or a disheveled coat.","Not really, seems like it's taking a break from the action."
Are there any distinctive features in the dog's facial markings?,The dog’s facial markings include the classic breed-specific patterns of contrasting colors and symmetrical distribution.,"Oh for sure, it's got that classic Springer mask and freckles."
What kind of maintenance does a coat like the dog's require?,A coat of such texture and length would necessitate regular grooming to maintain its condition.,"Regular brush-outs, I'd bet, to keep it looking this smooth."
Is the dog's breathing visible or not?,The dog’s respiration is not overtly apparent in the static image presented.,"Can't see any huffing and puffing, so it's all chill."
Does the dog appear to be focused on something outside of the picture?,The canine’s gaze does not seem to fixate on any entity beyond the photographic frame's boundary.,"Kinda, like it's waiting for a ""let's go"" or a treat toss."
What does the dog's presence add to the overall composition of the photograph?,The dog's presence introduces an element of vitality and a focal point of organic contrast to the inanimate surroundings.,"It's the star of the show, giving life to an otherwise plain room."
What is the posture of the dog?,"The dog is ensconced in an upright, seated position.","Just sittin' there, owning the floor."
How would you describe the dog's gaze?,"The dog's gaze is direct and attentive, indicating a focused demeanor.","It's giving the soft-eye, ""What's next?"" look."
What can be said about the dog's overall cleanliness?,The dog presents an appearance of meticulous cleanliness.,Looks pretty spick-and-span to me.
How are the dog's paws positioned?,"The forepaws of the canine are neatly positioned, one slightly in front of the other, upon the floor.","Neatly tucked in, like a proper gentleman."
What is the angle of the photograph in relation to the dog?,"The photograph is taken from a direct, frontal angle at the eye level of the canine.","Snapped from the front, just a tad above eye level."
Can you describe the shape of the dog's snout?,"The snout of the dog exhibits a moderate length and breadth, typical of its breed, with a square termination.",It's kinda long and a bit square-ish at the end—perfect for boopin'.
Is the dog's chest area visible in the image?,"The dog’s chest is partially visible, draped by its well-groomed coat.","Yeah, it's there, looking robust."
What can you infer about the dog's temperament?,"Based on its relaxed posture and direct gaze, one might infer a temperament that is both calm and alert.",Seems chill but probably has a playful side.
Is the dog in motion or stationary?,The dog is stationary in the image.,"Totally stationary, like it's posing for a portrait."
Does the dog appear alert or relaxed?,The dog appears to embody a state of relaxed alertness.,I'd say relaxed but still alert—like it's waiting for a command.
Can you see the dog's teeth?,The dog’s teeth are not visible; its mouth is closed.,"Nope, it's all lips sealed."
What is the background of the photograph?,"The background is domestic and unobtrusive, with minimal detail that would detract from the subject.",A cozy indoor vibe with books and stuff in the back.
Is the dog's back straight or curved?,"The dog’s back appears straight, following the natural posture of a seated position.",Straight as an arrow—good posture there!
How is the dog's weight distributed?,"The dog's weight appears to be evenly distributed on its haunches, providing a stable base.","It's all balanced on its haunches, ready to spring up or chill."
Are there any signs of shedding in the dog's coat?,There are no overt signs of shedding discernible in the photograph.,Not that I can tell—coat looks neat and tidy.
How would you describe the length of the dog's fur?,"The dog’s fur is of medium length, sufficient to provide warmth without excess.","Medium-length, not too short, not too shaggy."
Is there any visible drooling from the dog?,There is no visible drooling; the dog’s demeanor is composed.,"Nah, it's a dry scene, no drool in sight."
How symmetrical are the dog's facial features?,"The dog’s facial features exhibit a high degree of symmetry, contributing to its attentive expression.","Pretty symmetrical, like it could be a dog model."
What does the dog's body language suggest about its mood?,The dog's body language suggests a mood of tranquil attentiveness.,"Content, maybe a bit curious about what's going on."
Is there any visible identification tag on the dog's collar?,No visible identification tag is discernible in this image.,"Can't make out a tag, just the collar itself."