Question,en,es,fr
What breed of dog is this?,This is an English Springer Spaniel.,Esta es una raza de perro English Springer Spaniel.,C'est un chien de race English Springer Spaniel.,
What is the primary color of the dog's coat?,The primary color of the dog's coat is white.,El color primario del pelaje del perro es blanco.,La couleur principale du pelage du chien est le blanc.,
Does this dog have any distinctive markings?,"Yes, the dog has black patches and speckles.","Sí, el perro tiene marcas distintivas de color negro.","Oui, le chien a des marquages noirs distinctifs.",
What type of ears does this dog have?,"This dog has long, floppy ears characteristic of the breed.",El perro tiene orejas largas y caídas.,Le chien a des oreilles pendantes et longues.,
Is the dog's tail visible in the image?,"Yes, the dog's tail is visible and appears to be docked.","No, la cola del perro no es visible en la imagen.","Non, la queue du chien n'est pas visible sur l'image.",
What is the texture of the dog's fur?,The dog's fur looks smooth with some wavy areas on the ears.,La textura del pelo del perro parece ser lisa y medianamente larga.,Le pelage du chien semble lisse avec des franges ondulées sur les oreilles.,
Can you describe the dog's eyes?,"The dog has large, dark eyes that seem attentive and expressive.","Los ojos del perro son grandes y expresivos, con un color oscuro.",Les yeux du chien sont foncés et expressifs.,
What is the dog's general body shape and size?,"The dog has a medium-sized, compact body with a balanced build.",El perro tiene un cuerpo mediano y bien proporcionado.,Le chien a une forme corporelle robuste et de taille moyenne.,
"Is the dog wearing any identification, like a collar?","Yes, the dog is wearing a red collar, which might have ID tags.","Sí, el perro lleva un collar, lo que podría indicar que tiene identificación.","Oui, le chien porte un collier.",
What is the dog's posture in the image?,The dog is sitting upright on the floor.,El perro está sentado con una postura atenta.,Le chien est assis avec une posture droite.,
Is the dog's mouth open or closed?,The dog's mouth is closed.,La boca del perro está cerrada.,La bouche du chien est fermée.,
Does the dog appear to be in a relaxed state?,The dog appears to be calm and relaxed.,El perro parece estar en un estado tranquilo y relajado.,Le chien semble être dans un état détendu.,
What type of flooring is the dog sitting on?,The dog is sitting on hardwood flooring.,El perro está sentado en un suelo de madera.,Le chien est assis sur un parquet en bois.,
Can you see any toys or dog-related items in the image?,No toys or dog-related items are visible in the image.,No se ven juguetes ni artículos relacionados con perros en la imagen.,"Non, aucun jouet ou objet lié aux chiens n'est visible dans l'image.",
Is the dog alone in the picture or are there people/other animals present?,The dog is alone in the picture; no people or other animals are seen.,"El perro está solo en la imagen, no hay personas ni otros animales presentes.",Le chien est seul sur l'image.,
What kind of expression does the dog's face convey?,The dog's facial expression looks alert and focused.,La expresión del rostro del perro transmite calma y curiosidad.,L'expression du chien est calme et attentive.,
Does the dog have a shiny coat?,"The coat does appear shiny, particularly on the black patches.",El pelaje del perro parece tener un brillo saludable.,"Oui, le pelage du chien a un aspect brillant.",
"Are the dog's nails visible, and if so, are they well-trimmed?",The dog's nails are not clearly visible in the image.,Las uñas del perro no son claramente visibles en esta imagen.,Les ongles du chien ne sont pas visibles dans l'image.,
Is there anything unusual about the dog's appearance?,There is nothing unusual about the dog's appearance; it looks typical for its breed.,No hay nada inusual en el aspecto del perro en la imagen.,Rien d'inhabituel n'est à noter concernant l'apparence du chien.,
What could be the approximate age of the dog?,"It's challenging to determine age from an image, but the dog seems to be an adult.","Basado en la imagen, es difícil determinar la edad exacta del perro, pero parece ser un adulto.","Il est difficile de déterminer l'âge exact du chien, mais il semble être adulte.",
What is the stance of the dog?,"The dog is sitting with its front paws parallel, presenting a formal and attentive stance.",El perro tiene una postura sentada y alerta.,Le chien adopte une posture assise et attentive.,
How is the lighting in the photograph affecting the dog's appearance?,"The lighting in the photograph casts a warm glow, slightly overexposing the white areas of the dog's coat and creating a stark contrast with the black spots.","La iluminación en la fotografía es directa y brillante, lo que resalta el pelaje y las características del perro.",L'éclairage dans la photographie crée des reflets brillants sur le pelage du chien et met en évidence ses marquages.,
Are the dog's whiskers visible?,"Yes, the dog's whiskers are visible, mainly around the snout area.","Sí, se pueden observar las vibrisas del perro.","Oui, les moustaches du chien sont visibles.",
What is the expression in the dog's eyes?,The dog's eyes convey an expression of attentiveness and calm curiosity.,La expresión en los ojos del perro es de atención y curiosidad.,Les yeux du chien expriment la calme et la douceur.,
How would you describe the set of the dog's ears?,The dog's ears are set high on the head and hang down in a typical English Springer Spaniel manner.,Las orejas del perro están bien plantadas a los lados de la cabeza y cuelgan cerca de las mejillas.,Les oreilles du chien sont dressées naturellement mais retombent le long de sa tête.,
Is the dog's coat a single or double coat?,"The dog appears to have a double coat, which is characteristic of the breed.","El perro parece tener un pelaje doble, típico de la raza English Springer Spaniel.","Le chien semble avoir un pelage double, typique de la race.",
What is the condition of the dog's coat?,"The coat looks clean and well-maintained, suggesting good grooming.","El pelaje del perro se ve en buena condición, liso y bien cuidado.","Le pelage du chien semble être en bonne condition, propre et bien entretenu.",
Does the dog appear to have been groomed recently?,"The dog appears to have been groomed recently, evidenced by the smoothness of the fur and lack of visible debris.","Sí, el perro parece haber sido acicalado recientemente, dado el aspecto limpio y ordenado de su pelaje.",Il semble que le chien ait été toiletté récemment compte tenu de la propreté et de l'ordre de son pelage.,
What kind of environment is the dog in?,"The dog is indoors, in a domestic environment with minimal furnishings.","El perro se encuentra en un entorno interior, posiblemente una casa, sobre un suelo de madera.","Le chien se trouve à l'intérieur d'une maison, sur un parquet.",
How would you describe the build of the dog?,"The dog has a sturdy and well-proportioned build, indicating a healthy weight and muscle tone.","El perro tiene una constitución sólida y balanceada, típica de su raza.",La constitution du chien est robuste et bien proportionnée.,
Does the dog have a broad or narrow head?,"The dog has a broad head with a moderate stop and a slightly domed skull, typical of its breed.","El perro tiene una cabeza proporcional, ni demasiado ancha ni estrecha para su raza.","La tête du chien est plutôt large, avec un crâne bien développé.",
Are the dog's front legs visible in the image?,"Yes, the dog's front legs are visible and straight, showing good bone structure.","Sí, las patas delanteras del perro son visibles y están bien posicionadas.","Oui, les pattes avant du chien sont visibles et bien positionnées sous lui.",
Can you discern the dog's gender from the image?,The dog's gender is not discernible from the image provided.,No se puede determinar el género del perro con certeza solo con esta imagen.,"À partir de l'image, il est difficile de déterminer avec certitude le sexe du chien.",
Is there any indication of the dog's activity level?,There is no clear indication of the dog's activity level from the image.,No hay indicios directos del nivel de actividad del perro en la imagen.,Il n'y a pas d'indication claire du niveau d'activité du chien dans l'image.,
Does the dog look like it has been engaged in physical activity recently?,The dog does not exhibit signs of recent physical activity; it seems rested.,No hay señales obvias de que el perro haya participado en actividad física recientemente.,Il n'y a aucun signe évident que le chien se soit livré récemment à une activité physique intense.,
Are there any distinctive features in the dog's facial markings?,"The dog has distinctive facial markings, with a black patch covering the right eye and ear, and a white blaze running up the center of the face.","Sí, el perro tiene marcas faciales distintivas, con áreas negras alrededor de los ojos y las orejas que contrastan con el blanco del resto de su pelaje.","Le chien présente des marquages faciaux distinctifs, avec des taches noires autour des yeux et des oreilles.",
What kind of maintenance does a coat like the dog's require?,"A coat like the dog's requires regular brushing to prevent mats and to remove loose fur, especially during shedding seasons.","Un pelaje como el del perro requiere un mantenimiento regular, incluyendo cepillado frecuente para evitar enredos y mantenerlo limpio y ordenado.","Un pelage comme celui-ci nécessite un entretien régulier, incluant brossage fréquent et bains.",
Is the dog's breathing visible or not?,The dog's breathing is not visibly noticeable in the photograph.,No es posible observar la respiración del perro en la imagen.,La respiration du chien n'est pas visible dans l'image.,
Does the dog appear to be focused on something outside of the picture?,"The dog appears to be focused on something out of view, as its gaze is directed off-camera.","El perro parece estar mirando fijamente, lo que podría indicar que su atención está puesta en algo o alguien fuera de la imagen.","Le chien semble concentré sur quelque chose hors champ, son regard étant dirigé vers l'avant.",
What does the dog's presence add to the overall composition of the photograph?,"The dog's presence adds a sense of warmth and life to the photograph, anchoring the composition with its central position and contrasting colors.",La presencia del perro añade un sentido de calma y un punto focal vivo que contrasta con el entorno inanimado de la habitación.,La présence du chien ajoute un élément de vie et un point focal chaleureux à la composition de la photographie.,
What is the posture of the dog?,The dog is sitting upright with a poised and attentive posture.,El perro está sentado erguido con una postura firme.,Le chien est assis de manière droite et attentive.,
How would you describe the dog's gaze?,"The dog's gaze is directed forward, showing focus and alertness.","La mirada del perro es directa y atenta, parece estar concentrado en algo o alguien fuera del encuadre de la foto.","Le regard du chien est fixe et attentif, comme s'il observait quelque chose.",
What can be said about the dog's overall cleanliness?,The dog appears to be very clean with no visible dirt or debris in its coat.,"El perro se ve limpio, lo que sugiere que es bien cuidado.","Le chien semble très propre, sans saleté visible sur son pelage.",
How are the dog's paws positioned?,"The dog's paws are neatly positioned in front, with one slightly overlapping the other.","Las patas del perro están bien plantadas en el suelo, mostrando una posición estable.","Les pattes du chien sont bien posées à plat sur le sol, sous son corps.",
What is the angle of the photograph in relation to the dog?,"The photograph is taken from a frontal angle, slightly above the dog's eye level.","La fotografía está tomada a nivel del perro, posiblemente mientras el fotógrafo estaba agachado o sentado frente a él.","La photo est prise de face, au niveau du chien, ce qui permet de voir directement son visage.",
Can you describe the shape of the dog's snout?,"The dog's snout is of moderate length and appears slightly square, which is typical for the breed.","El hocico del perro es de longitud media y bien formado, típico de un English Springer Spaniel.","Le museau du chien est de forme moyenne, ni trop long ni trop court, avec un bout arrondi.",
Is the dog's chest area visible in the image?,"Yes, the dog's chest is visible, showing a white coat with some black speckling.","Sí, la zona del pecho del perro es visible y parece ser amplia y robusta.","Oui, le poitrail du chien est visible et semble être large et bien développé.",
What can you infer about the dog's temperament?,The dog's calm posture and attentive eyes suggest a good-natured and obedient temperament.,El perro da la impresión de tener un temperamento calmado y atento.,"Le chien donne une impression de calme et de douceur, ce qui peut indiquer un tempérament placide.",
Is the dog in motion or stationary?,"The dog is stationary, with no signs of movement.",El perro parece estar quieto y estacionario en la imagen.,Le chien est immobile et semble posé confortablement sur le sol.,
Does the dog appear alert or relaxed?,"The dog appears alert, as indicated by its erect posture and focused gaze.","El perro parece estar alerta pero tranquilo, con una expresión atenta pero no ansiosa.",Le chien semble détendu mais attentif à son environnement.,
Can you see the dog's teeth?,The dog's teeth are not visible; its mouth is closed.,"No, los dientes del perro no son visibles en la imagen.","Non, les dents du chien ne sont pas visibles dans l'image.",
What is the background of the photograph?,"The background is a domestic interior setting, with a couch and a bookshelf.",El fondo de la fotografía es una habitación interior con un suelo de madera y algunos muebles y objetos alrededor.,L'arrière-plan est constitué d'un intérieur domestique avec un plancher en bois et des meubles.,
Is the dog's back straight or curved?,"The dog's back is straight, supporting its upright sitting position.","La espalda del perro parece estar recta, en línea con su postura sentada.","Le dos du chien est droit et aligné, ce qui est typique d'une posture assise correcte.",
How is the dog's weight distributed?,"The weight appears evenly distributed on its haunches, typical of a sitting dog.",El peso del perro parece estar distribuido de manera uniforme entre sus cuatro patas.,Le poids du chien semble être réparti de manière équilibrée sur ses quatre pattes.,
Are there any signs of shedding in the dog's coat?,There are no obvious signs of shedding in the dog's coat in the photograph.,No hay signos evidentes de muda de pelo en el perro en la imagen.,Il n'y a pas de signes évidents de perte de poils dans l'image.,
How would you describe the length of the dog's fur?,"The length of the dog's fur is medium, with longer feathering on the ears and legs.","La longitud del pelo del perro es media, típica de la raza.",La longueur du poil du chien est moyenne avec des franges plus longues sur les oreilles.,
Is there any visible drooling from the dog?,There is no visible drooling; the dog's mouth is closed and tidy.,No hay rastros visibles de babeo en el perro.,Il n'y a pas de bave visible sur la photo.,
How symmetrical are the dog's facial features?,"The dog's facial features are quite symmetrical, with balanced markings on either side of the face.",Las características faciales del perro son simétricas y acordes a la raza.,Les traits du visage du chien semblent symétriques et bien proportionnés.,
What does the dog's body language suggest about its mood?,The dog's body language suggests a state of calm attentiveness.,El lenguaje corporal del perro sugiere que está en un estado de alerta tranquila.,Le langage corporel du chien suggère qu'il est à l'aise et content dans son environnement.,
Is there any visible identification tag on the dog's collar?,"An identification tag is not clearly visible; however, the dog is wearing a collar that may contain tags.","Aunque el perro lleva un collar, no se puede discernir claramente si hay una etiqueta de identificación visible en la imagen.",Il n'est pas possible de voir s'il y a une étiquette d'identification sur le collier du chien dans l'image.,