Question,formal,informal
What is the primary material of the French horn in the image?,The French horn is predominantly composed of brass.,Looks like brass to me.,
How many valves does the French horn have?,This instrument features a total of four valves.,Four of them.,
What is the color of the French horn?,The hue of the French horn can be described as gold.,Kind of a gold-ish or brass color.,
Is there any visible branding or maker's mark on the French horn?,"Upon inspection of the image, no branding or maker's mark is visible.","Nah, can't see any logos or marks.",
What type of finish does the French horn have?,The finish of the horn appears to be lacquered.,"That's a lacquer finish, a bit worn out though.",
Does the French horn have a detachable bell?,The image does not provide sufficient detail to determine whether the bell is detachable.,"Nope, doesn't look like it pops off.",
What is the shape of the French horn's bell?,The bell exhibits the traditional flared shape characteristic of a French horn.,"That's the classic flared shape, pretty wide.",
Are there any noticeable dents or damage on the French horn?,There are no noticeable dents or signs of damage on the French horn as seen in the image.,"Hard to tell from here, but nothing’s screaming ""I'm dented!""",
What is the approximate size of the French horn?,"The French horn appears to be of a medium size, which is standard for such instruments.",Pretty standard; these horns are usually about 12-13 inches in bell diameter.,
Does the French horn have a thumb lever or a trigger?,A thumb lever is present on the instrument.,"Yep, there's a thumb lever right there.",
How many tubing turns are there in the French horn's body?,"The French horn displays multiple tubing turns; however, an exact count is not visible in the image.","A bunch - looks like the standard French horn wrap, so around 12-15 turns maybe?",
Does the French horn have a mouthpiece attached?,The horn is currently without a mouthpiece attached.,Can't spot a mouthpiece from this angle.,
"What type of French horn is depicted (single, double, triple, or descant)?","The specific type of French horn (be it single, double, triple, or descant) cannot be determined from the provided image without further context.",Looks double to me because of the extra tubing and fourth valve.,
"Is the French horn designed for a student, intermediate, or professional level?","The design level of the French horn (student, intermediate, or professional) cannot be ascertained from the image alone.","Without any branding, tough to say, but let’s guess it’s for an intermediate player.",
Are the valve slides visible in the image?,The valve slides are indeed visible in the image.,"Yeah, you can see the slides peeking out there.",
What kind of valve rotors does the French horn have?,The instrument is equipped with rotary valves.,"Those are rotary valves, the usual for French horns.",
Is there a water key present on the French horn?,A water key is not discernible in the provided image.,No water key in sight.,
Does the French horn show signs of repair or soldering?,There are no apparent signs of repair or soldering.,"Nothing obvious, but who knows without a closer look?",
What is the condition of the valve caps and levers?,"The condition of the valve caps and levers is good, albeit with some indications of patina or wear.","They seem okay, nothing's jumping out as wrong.",
Are there any accessories shown with the French horn in the image?,No accessories are present with the French horn in the image.,"Nope, just the horn itself.",
Is the French horn's bell engraved?,The bell of the French horn does not appear to be engraved.,No fancy artwork or engravings to see here.,
What is the general condition of the French horn?,The general condition of the French horn seems to be fair with visible signs of use and age.,"It's been loved, for sure. Showing some age and wear.",
Are the rotors string or mechanical linkage?,It is not possible to ascertain whether the rotors are string or mechanical linkage from the image.,Those are mechanical linkages. No strings attached!,
Does the French horn have any tuning slides pulled out?,There are no tuning slides visibly pulled out in the image provided.,"They're all snug in their homes, no slides out.",
Can you identify the bore size of the French horn from the image?,The bore size of the French horn cannot be identified from the image.,"Nah, can’t eyeball that. You'd need a caliper or something.",
Is the French horn a compensating or full double horn?,"Without additional context, it is impossible to determine whether it is a compensating or full double horn.",It's giving off strong full double vibes with that tubing and valve setup.,
What is the angle of the French horn's bell relative to its body?,The angle of the bell in relation to the body cannot be determined from this perspective.,The bell's kinda facing up? Maybe like a 30-ish degree angle from the body.,
Can you see if the French horn has an adjustable pinky hook?,The image does not show whether the French horn has an adjustable pinky hook.,"Can't tell, that pinky hook is playing hard to get, hiding from the camera.",
Does the French horn have a protective case with it?,There is no protective case visible in the image.,"No case in the pic, just the horn chillin’ on its own.",
What era or style does the French horn design suggest?,The era or style suggested by the design of the French horn cannot be definitively concluded without further historical context.,"It's got a timeless look, could be mid-20th-century style but who knows without a date?",
Is there a leadpipe visible in the French horn?,The leadpipe is indeed visible in the image.,"Yep, the leadpipe is right there, running alongside the valves.",
Are there any numbers or letters visible on the valves or slides?,No numbers or letters are discernible on the valves or slides from the image.,No digits or alphabets making an appearance.,
Do the valve keys appear to be mother of pearl or another material?,The material of the valve keys cannot be determined; they do not clearly appear to be mother of pearl or any other specific material.,"Can't really tell, but they don’t have the pearly shine. Probably just metal.",
Is the French horn set up for left or right hand playing?,The setup for left or right-hand playing is not discernible in the image.,"It's set up for the right hand, as per the usual French horn shenanigans.",
Are there any additional braces or supports visible on the French horn?,No additional braces or supports beyond the standard construction are visible.,"Not really, just the standard supports where you’d expect them.",
What kind of taper does the French horn's bell have?,The specific kind of taper of the bell cannot be determined from the image.,"That’s a gradual taper, classic French horn style.",
Can you tell if the French horn has been relacquered?,There is no clear evidence to determine if the French horn has been relacquered.,"If it’s been done, they kept it on the down-low. Looks original to me.",
Does the French horn have any custom modifications visible?,There are no visible custom modifications to the French horn.,"It's keeping its cards close, nothing custom popping out.",
What is the state of the French horn's leadpipe?,"The state of the leadpipe appears to be consistent with the overall condition of the horn, which shows signs of use.","The leadpipe looks solid, no red flags there.",
Are there any silencers or mutes visible with the French horn?,There are no silencers or mutes visible with the French horn in the image.,No sneaky silencers or mutes hanging around. Just the horn solo.,
What is the diameter of the French horn's bell?,The diameter of the French horn's bell cannot be measured from the image.,"Can't measure it from here, but French horn bells are usually about 12 inches across.",
Does the French horn appear to have a fixed or screw bell?,It is not possible to ascertain from the image whether the French horn has a fixed or screw bell.,"That bell looks like it's there to stay, not the screw-on type.",
Are there any visible soldering joints on the French horn?,No visible soldering joints can be observed in the provided image.,"Nothing screaming ""I've been soldered!"" so they’re either super clean or just not there.",
What is the condition of the French horn's lacquer?,"The lacquer appears aged and shows signs of wear, indicating a used condition.","It's seen better days. Some spots are more ""au naturel"" than others.",
Does the French horn have any valve caps or bumpers?,"Valve caps are present; however, it is not clear if bumpers are installed due to the image's resolution.","Yep, you can see the valve caps. Bumpers? Not so much from here.",
Are the French horn's rotors encased or exposed?,"The rotors appear to be encased, as is typical for French horns.",All snuggled up and encased.,
"What is the French horn's country of origin, if visible?",The country of origin is not visible in the image.,"No telling without any marks or labels, it’s keeping its passport a secret.",
Does the French horn have a ring for a music lyre?,A ring for attaching a music lyre is not visible in the image.,No shiny ring for a lyre to be seen.,
Is the thumb valve wrapped in a cord or string?,The thumb valve does not appear to be wrapped in cord or string.,No cord. It's got that solid mechanical linkage.,
What is the condition of the French horn's leadpipe?,"The leadpipe seems to be in a condition consistent with the rest of the instrument, which shows general wear.","From this VIP seat, the leadpipe looks decent, no drama.",
Are the valve levers contoured or straight?,"The valve levers appear to be straight, which is common in French horn designs.",Those levers look pretty straight to me.,
"Does the French horn have a fourth valve, and what is its purpose?",A fourth valve is present; its purpose is to provide an alternative tuning and extend the range of the horn.,"Yep, there’s a fourth buddy, probably to hit lower notes and make tuning smoother.",
Are any custom engravings visible on the French horn?,There are no custom engravings visible on the French horn in the image.,"Clean as a whistle, no engravings.",
Is the bell of the French horn dented or in pristine condition?,The bell does not show any dents and is in what could be considered a pristine condition.,"No obvious dings, but it’s not exactly factory fresh either.",
What kind of mouthpiece would fit this French horn?,"A standard French horn mouthpiece would fit this instrument, specifics cannot be determined from the image.","Can't say for sure without trying, but it’s probably a standard French horn mouthpiece situation.",
Are there signs of heavy wear on the French horn?,There are indications of use but not necessarily heavy wear; the instrument shows a well-maintained condition.,"It’s got character lines, aka some wear, but nothing too tragic.",
Does the French horn have a clear or colored lacquer?,"The lacquer appears clear, as the metal's color is visible through it.","It’s all natural, baby – clear lacquer.",
"What is the French horn's wrap style (Geyer, Kruspe, etc.)?",The wrap style cannot be identified without a more comprehensive view of the instrument's tubing layout.,"Could be a Geyer with that thumb valve position, but don’t quote me.",
Is the metal of the French horn thin or thick gauge?,The gauge of the metal cannot be determined from the image provided.,"It's playing it cool, hard to say if it's thick or thin gauge without a hands-on inspection.",
Are there felt pads under the French horn's valve levers?,The presence of felt pads under the valve levers cannot be confirmed from the image.,"The pads might be there, but they're camera shy. Can’t see 'em.",